[
  { "regel_id": "REG-001", "gegenpartei_pattern": "MusterladenB|MusterladenC|MusterladenA", "kategorie_id": "KAT-004", "status": "aktiv", "erstellt_am": "2026-06-01", "kommentar": "Supermaerkte als Lebensmittel" },
  { "regel_id": "REG-002", "gegenpartei_pattern": "Muster GmbH|Nordstadt Pflege", "vorzeichen": "einnahme", "kategorie_id": "KAT-001", "status": "aktiv", "erstellt_am": "2026-06-01", "kommentar": "Regelmaessige Gehaltseingaenge" },
  { "regel_id": "REG-003", "gegenpartei_pattern": "Familienkasse", "kategorie_id": "KAT-002", "status": "aktiv", "erstellt_am": "2026-06-01", "kommentar": "Kindergeld" },
  { "regel_id": "REG-004", "gegenpartei_pattern": "Stadtwerke|Hausverwaltung", "kategorie_id": "KAT-003", "status": "aktiv", "erstellt_am": "2026-06-01", "kommentar": "Wohnen, Energie und Hausgeld" },
  { "regel_id": "REG-005", "gegenpartei_pattern": "Kita|Schule", "kategorie_id": "KAT-006", "status": "aktiv", "erstellt_am": "2026-06-01", "kommentar": "Kinderbezogene Zahlungen" }
]
